{
  "schema_version": "1.0",
  "request_id": "req-3f9c1d2e-0001",
  "status": "ok",
  "data": {
    "query": "삼성전자 2026 실적 발표",
    "results": [
      {
        "title": "삼성전자 실적발표 자료실",
        "url": "https://www.samsung.com/sec/ir/quarterly-results/",
        "snippet": "분기 실적 발표 자료와 컨퍼런스콜 녹취를 제공합니다.",
        "retrieval_score": 0.93,
        "source": "self_hosted",
        "authority_hint": true,
        "security_warning": null
      },
      {
        "title": "DART 공시 — 삼성전자",
        "url": "https://dart.fss.or.kr/dsaf001/main.do?rcpNo=20260918000001",
        "snippet": "연결재무제표 기준 영업이익 공시.",
        "retrieval_score": 0.88,
        "source": "searxng",
        "authority_hint": true,
        "security_warning": null
      }
    ],
    "signal_confidence": "HIGH",
    "decomposed_subqueries": null,
    "cached": false,
    "cache_age_ms": null,
    "phishing_filtered": 2,
    "source_failures": [],
    "claim_verification": null
  },
  "evidence": [
    {
      "evidence_id": "ev-0001",
      "requested_url": "https://www.samsung.com/sec/ir/quarterly-results/",
      "final_url": "https://www.samsung.com/sec/ir/quarterly-results/",
      "retrieved_at": "2026-09-18T11:20:04Z",
      "title": "삼성전자 실적발표 자료실",
      "publisher": "Samsung Electronics",
      "published_date": null,
      "extraction_tier": "TIER_1_STATIC",
      "content": {
        "locator": "main > section.results",
        "sha256": "6cac8dbcaa1175b13ebf64f133b6743173baea0ff1ba7002072e0df5e7143664",
        "bytes": 18422,
        "token_count": 3102,
        "tokenizer": "estimateTokens/v1"
      },
      "truncated": false,
      "truncation": null,
      "artifact_ref": null
    }
  ],
  "error": null,
  "usage": {
    "provider_calls": 3,
    "content_tokens": 3102,
    "accounted": {
      "json_framing_tokens": 41,
      "evidence_overhead_tokens": 96
    }
  },
  "timings": {
    "total_ms": 1875.6,
    "queue_ms": 0.0,
    "provider_ms": 1620.4,
    "extract_ms": 210.1
  },
  "warnings": ["self_hosted provider answered first; searxng used as corroboration"]
}
