{
  "schema_version": "1.0",
  "request_id": "req-3f9c1d2e-0004",
  "status": "blocked",
  "data": null,
  "evidence": [],
  "error": {
    "code": "POLICY_DENIED",
    "message": "요청한 URL이 사설 주소 대역(127.0.0.0/8)이라 추출하지 않았다.",
    "retryable": false,
    "stage": "policy",
    "detail": "requested_url host resolves to loopback; DNS precheck + connect-time address pinning both rejected",
    "suggested_action": "STOP — 정책 거절은 provider fallback으로 우회하지 않는다. 공개 URL을 다시 요청한다."
  },
  "usage": null,
  "timings": {
    "total_ms": 3.2,
    "queue_ms": 0.0,
    "provider_ms": null,
    "extract_ms": null
  },
  "warnings": ["Jina/sidecar 호출 수 0 — 정책 거절은 하위 tier로 내려가지 않았다"]
}
