{
  "schema_version": "1.0",
  "request_id": "req-3f9c1d2e-0007",
  "status": "blocked",
  "data": null,
  "evidence": [],
  "error": {
    "code": "UNSUPPORTED_CAPABILITY",
    "message": "이 서버 버전은 요청한 capability(ssak_browser_act)를 제공하지 않는다.",
    "retryable": false,
    "stage": "negotiation",
    "detail": "tools/list 에 ssak_browser_act 없음; 서버 serverInfo.version=2.9.0",
    "suggested_action": "tools/list 로 지원 도구를 확인하고 다른 도구를 쓴다. 임의 method를 반사하지 않는다."
  },
  "usage": null,
  "timings": {
    "total_ms": 1.1,
    "queue_ms": null,
    "provider_ms": null,
    "extract_ms": null
  },
  "warnings": []
}
