{
  "schema_version": "1.0",
  "request_id": "req-3f9c1d2e-0008",
  "status": "partial",
  "data": {
    "query": "삼성전자 2026 실적 발표",
    "results": [
      {
        "title": "삼성전자 실적발표 자료실",
        "url": "https://www.samsung.com/sec/ir/quarterly-results/",
        "snippet": "분기 실적 발표 자료와 컨퍼런스콜 녹취를 제공합니다.",
        "retrieval_score": 0.93,
        "source": "naver",
        "authority_hint": true,
        "security_warning": null
      }
    ],
    "signal_confidence": "MEDIUM",
    "decomposed_subqueries": null,
    "cached": false,
    "cache_age_ms": null,
    "phishing_filtered": 2,
    "source_failures": [
      {
        "source": "bing",
        "code": "UPSTREAM_UNAVAILABLE",
        "retryable": true,
        "detail": "legacy aborted_backends 항목이며 실패 stage는 알 수 없다"
      }
    ],
    "claim_verification": null
  },
  "evidence": [],
  "error": null,
  "usage": {
    "provider_calls": null,
    "content_tokens": null,
    "accounted": {
      "json_framing_tokens": null,
      "evidence_overhead_tokens": null
    }
  },
  "timings": {
    "total_ms": 1620.0,
    "queue_ms": null,
    "provider_ms": 1620.0,
    "extract_ms": null
  },
  "warnings": [
    "legacy text fallback: tool result 에 structuredContent 가 없어 text JSON 을 계약 schema 로 해석했다",
    "legacy 응답에는 request_id/evidence/usage 가 없어 null 로 남긴다(0으로 위장하지 않음)"
  ]
}
